Task,Difficulty,Problem Statement,Patterns,Hints,Last Revised Date,Notes
TrappingRainWater,Medium,Calculate how much rainwater can be trapped between elevation bars.,"Two Pointers, Auxiliary Arrays, Stack (Monotonic)","Two Pointers: Use two pointers (L and R) and track the ‘max_left‘ and ‘max_right‘ seen so far. The water trapped at a pointer is max(0,min(max_left,max_right)−height[pointer]). Move the pointer corresponding to the smaller maximum height.",,
MissingNumber,Easy,Find the missing number in an arraycontaining n distinct numbers from range 1 to N,"Summation/XOR, Array Properties","The most efficient method uses the XOR property: XOR of a number with itself is 0. XOR all numbers from 0 to N with all numbers in the array. The result is the missing number. Alternatively, calculate the expected sum of 0 to N and subtract the array sum.",,
MinFlipsToMonotoneIncreasing,Hard,Find minimum flips to make binary string monotone increasing.,"Dynamic Programming, Greedy, Prefix Sum","Track variables onesCount and flipCount. If 1 is encountered, increment onesCount. If 0 is encountered, we have 2 choice - either flip previous ones (onesCount) or flip current zero (flipCount++). Take min of these",7-Sep-2025,The approach of using O(1) space complexity is not intuitive
MinimumDeletionsToMakeFrequenciesUnique,Hard,Find minimum deletions to make all character frequencies unique.,"Hash Map, Greedy, Set","First, count the frequencies using a HashMap. Then, use a greedy approach: iterate through the frequencies. If a frequency is already used (check using a Set), try to decrement it until it becomes a unique frequency or 0.",7-Sep-2025,
TicTacToe,Easy,Design a Tic-Tac-Toe game.,"Array/Matrix Manipulation, Win Condition Check","Check for the win condition after every move. The win conditions are: 1) a full row, 2) a full column, or 3) a full diagonal. Store the state of each row, column, and diagonal to check in O(1) after each move.",,
MeetingSchedule,Easy,Determine if a person can attend all meetings.,"Sorting, Interval/Time Slot Check",Sort the meetings by their start time. Check for overlap: meeting[i] and meeting[i−1] overlap if meeting[i].start<meeting[i−1].end.,,
MeetingRoomsIII,Very Hard,Given a list of meeting timings and k meeting rooms. find meeting room which held most number of meetings.,"Heap (Min-Heap), Interval Scheduling","Use two Min-Heaps: one for available rooms (storing the room index) and one for busy rooms (storing ‘end_time‘,‘room_index‘). Prioritize rooms that finish earliest. Use a count array to track usage. If all rooms are busy, delay the start time of the current meeting to the min(end_time) of the busy rooms.",7-Sep-2025,
KthElement,Impossible,Find the kth smallest/largest element in 2 sorted arrays,"Binary Search, Partitioning (similar to MedianArrays)",Use binary search on the smaller array to partition both arrays such that exactly k elements are in the left partitions. The kth element is the maximum of the two left partition ends. Key: ensure all left elements ≤ all right elements.,7-Sep-2025,
RottenOranges,Easy,Find minimum time to rot all oranges in a grid.,"BFS, Multi-Source Traversal","Start the BFS queue with all rotten oranges (multi-source BFS). Use the BFS layer-by-layer to represent the passing of one minute. The final time is the number of layers (depth) in the BFS, provided all fresh oranges are eventually rotten.",,
SwapAdjacentInLRString,Hard,Determine if one string can be transformed to another by swapping adjacent characters.,"Two Pointers, Pattern Matching, Relative Order","The number of L's and R's must be the same and in the same relative order. Additionally, an ’L’ can only move left (its index in start must be ≥ its index in end), and an ’R’ can only move right (its index in start must be ≤ its index in end).",15-Sep-2025,
PushDominoes,Hard,Simulate dominoes falling after initial pushes.,"Two Pointers, String/Array Simulation","Look for the forces between pairs of non-'.' characters. If ’R’…’R’, all fall right. If ’L’…’L’, all fall left. If ’R’…’L’, they fall towards the center, with the middle remaining standing if the distance is odd. If ’L’…’R’, nothing happens in between.",15-Sep-2025,
BinarySearch,Easy,Implement binary search algorithm.,"Binary Search, Divide and Conquer","The core idea is to check the middle element and discard the half that cannot contain the target, repeatedly halving the search space.",,
SortColors,Hard,"Sort an array of 0s, 1s, and 2s in-place.","Three Pointers, Dutch National Flag Algorithm","Use Three Pointers: L (next position for 0), R (next position for 2), and i (current element). Swap nums[i] with nums[L] if it's 0. Swap nums[i] with nums[R] if it's 2. If it's 1, just move i.",15-Sep-2025,Edge case of 2 swapping is missed
ContainerWithMostWater,Medium,Find two lines that together with x-axis form a container with maximum water.,"Two Pointers, Optimization","Use Two Pointers starting at the ends (L=0,R=N−1). The area is min(height[L],height[R])×(R−L). To maximize area, move the pointer that points to the shorter line, as this might potentially lead to a larger minimum height later.",,
BiggestCakePiece,Medium,Find the largest area piece of cake after horizontal and vertical cuts.,"Sorting, Interval/Range Maximization","Sort the horizontal cuts, and sort the vertical cuts. The maximum area is max(diff_h)×max(diff_v), where diff is the maximum difference between consecutive cuts (including 0 and the cake size).",,
ProductExceptSelf,Medium,Return array where each element is product of all elements except itself.,"Array Manipulation, Prefix/Suffix Products",Create two auxiliary arrays: ‘prefix‘ (stores the product of all elements to the left of i) and ‘suffix‘ (stores the product of all elements to the right of i). The result at i is prefix[i]×suffix[i]. This can be optimized to use only O(1) extra space by calculating in two passes.,,
BoundedRobot,Easy,Determine if robot stays within a circle after executing instructions.,"Geometry, State Simulation","Simulate the robot's moves. The robot is bounded if: 1) It returns to (0,0) after one cycle of instructions, OR 2) Its final direction is NOT North (i.e., it's not the initial direction 0).",,
MergeKSortedArrays,Medium,Merge k sorted arrays into one sorted array.,"Heap (Min-Heap), K-way Merge","Use a Min-Heap to store the smallest element from each of the K arrays. The heap stores (‘value‘, ‘array_index‘, ‘element_index‘). Continuously extract the minimum, add it to the result, and insert the next element from the same array into the heap.",11-Sep-2025,
RotatedSortedSearch,Medium,Search in a rotated sorted array.,"Binary Search, Pivot Handling","The array is split into two sorted halves. The key is to determine which half the target might lie in. After calculating mid, check if the left half (nums[low]…nums[mid]) is sorted. If the target is in that range, search left; otherwise, search right.",,
RotatedSortedSearchWithDuplicates,Hard,Search in a rotated sorted array with duplicate elements.,"Binary Search, Duplicate Handling","Same as the non-duplicate version, but if nums[low]=nums[mid]=nums[high], you cannot determine the sorted side. In this specific case, the only recourse is to shrink the window by moving low++ and high−−.",11-Sep-2025,The condition of duplicate on boundary is bit tricky. Need to recognize this pattern properly
JumpGame,Medium,Determine if you can reach the last index.,"Greedy, Array Traversal","The goal is to determine if the last index is reachable. Iterate backwards: maintain a variable ‘goal‘ set to the last index. In the loop, if an index i can reach ‘goal‘, update ‘goal‘=i. The answer is ‘goal‘==0.",11-Sep-2025,Got the approach but might have faced issue in the implementation
LongestConsecutiveSequence,Medium,Find length of longest consecutive elements sequence.,"Hash Set, Sequence Detection","Put all numbers into a HashSet for O(1) look-up. Iterate through the set. For each number, only start counting if it is the start of a sequence (i.e., number−1 is not in the set). Then, count the length of the sequence number,number+1,number+2,…",,"BIt fuzzy approach, could have done better"
DeleteRepeatingLetter,Medium,Remove duplicate letters to get smallest lexicographic order.,"String/Array Manipulation, Two Pointers","Use a Two Pointers approach. One pointer i is the original index, and the other pointer j is the index for the modified string. If char[i] is different from the previous character, copy it to char[j]; otherwise, skip.",,Able to come up with approach and also think about the code quite well
MedianFinder,Hard,Design a data structure to find median from a stream of integers.,"Two Heaps, Data Stream","Use two heaps: a Max-Heap (‘lower_half‘) for the smaller half of the numbers, and a Min-Heap (‘upper_half‘) for the larger half. The heaps must be balanced: size(‘lower_half‘)≈size(‘upper_half‘). The median is either max(‘lower_half‘) or (max(‘lower_half‘)+min(‘upper_half‘))/2.",29-Sep-2025,I remembered heap approach but still bit difficult that how to balance heaps
SudokuSolve,Medium,Solve a Sudoku puzzle.,"Backtracking, Recursion, Constraint Tracking","Use Backtracking/DFS. For the first empty cell, iterate through digits 1−9. Check if the digit is valid in the row, column, and 3×3 sub-box. If valid, place the digit and recurse. If recursion returns true, the puzzle is solved; otherwise, backtrack (undo the placement) and try the next digit.",,"Intuitive appraoch, bit difficulty with the storage and finding block of a index"
PairDivisibleBy60,Easy,Count pairs of songs with total duration divisible by 60.,"Hash Map, Modular Arithmetic",The condition for time[i]+time[j] to be divisible by 60 is that (time[i]mod60)+(time[j]mod60) must equal 60 (or 0 if both are 0). Use a HashMap to store the frequency of remainders (time[i]mod60). The required complement remainder is (60−remainder)mod60.,,Intuitive approach. Easy to solve
TwoSum,Easy,Find two numbers that add up to a target sum.,"Hash Map, Single Pass","Use a HashMap to store the numbers encountered so far as the key and their index as the value. For each number nums[i], check if target−nums[i] is already in the map.",,Easy
FactorsCombination,Medium,Find all combinations of factors for a given number.,"Backtracking, Recursion, Factorization","Use Backtracking/DFS. For a number n, iterate through all possible factors i from 2 up to n​ (or the previous factor). Add i to the current combination, and recursively find factors for the quotient n/i.",,"Easy to come up with approach, might face issue in code implementation"
LetterCombination,Medium,Generate all letter combinations from a phone number.,"Backtracking, Recursion, Permutation/Combination","Use Backtracking/DFS. The depth of the recursion is the length of the digits string. At each level of the recursion, iterate through the characters corresponding to the current digit and append them to the current combination before making the recursive call.",,Chose bit incorrect approach of using string manipulation without recursion
NumberOfPaths,Medium,Count number of paths from top-left to bottom-right in a grid.,"Dynamic Programming, Combinatorics, Grid Traversal","DP State: dp[i][j] is the number of ways to reach cell (i,j). Recurrence: dp[i][j]=dp[i−1][j]+dp[i][j−1]. Alternatively, this is a simple combinatorics problem: (m−1m+n−2​) or (n−1m+n−2​) (choosing m−1 'Down' moves from a total of m+n−2 moves).",,Easy to come up with the approach. Came up with iterative appraoch and added it also to solution
Combinations,Hard,"Return all possible combinations of k numbers chosen from the range [1, n]","Backtracking, Recursion, Combinatorics","Build combinations one number at a time using backtracking. Always move forward (use a start pointer) to avoid duplicates, and prune early when remaining numbers can't complete the target size",,
CombinationSum,Medium,Find all unique combinations that sum to a target. (Each number can be used multiple time),"Backtracking, Recursion","Use Backtracking/DFS. The key is that elements can be reused. In the recursive call, if an element candidates[i] is used, the next call can still use candidates[i] (by passing i as the starting index).",,Can come up with approach and corrected the solution
CombinationSum2,Hard,Find all unique combinations that sum to target (each number used once).,"Backtracking, Recursion, Duplicate Handling","Use Backtracking/DFS. The key is that elements are unique for each combination (i.e., cannot be reused) and there are duplicates in the input array. Sort the array and use a check: if index>start and candidates[index]=candidates[index−1], then skip the current element to avoid duplicate combinations.",,Got confused on why the duplicates needs to be skipped in the skip branch of recursion
RestoreIpAddress,Medium,Restore valid IP addresses from a string of digits.,"Backtracking, Recursion, String Partitioning","Use Backtracking/DFS to try partitioning the string into four parts. Each part must be a valid IP segment (length 1 to 3, value ≤255, and no leading zeros unless the segment is ""0""). The recursion depth is 4.",,
BasicCalculator2,Medium,"Implement a calculator supporting +, -, *, /.","Stack, Operator Precedence","Use a Stack to store numbers. Process multiplication and division immediately. For addition/subtraction, simply push the number (or its negative for subtraction) onto the stack. The final result is the sum of all elements in the stack.",2-Sep-2025,Got the basic approach of handling the / x before + - but faced issue in the stack type and character to number conversion
BasicCalculator3,Very Hard,"Implement a calculator supporting +, -, *, /, and parentheses.","Recursion, Stack, Operator Precedence","This is essentially Basic Calculator II logic nested with recursion for parentheses. Use a Stack to handle operator precedence (multiplication/division first). When an opening parenthesis '(' is encountered, make a recursive call to evaluate the sub-expression. When a closing parenthesis ')' is encountered, return the result of the current sub-expression.",15-Sep-2025,Very different from basic calculator 2. Didn't think of the recursive appraoch
MinimumRemoveToMakeValidParentheses,Hard,Check how many parentheses needs to be deleted to make parentheses balanced and valid.,"Stack, String Manipulation, Multiple Parenthesis Types","Use a Stack to track unclosed open parentheses. When a closing parenthesis is encountered, check if the stack top is the matching open parenthesis. The added complexity often involves matching two types of parentheses or a mix of stars and parentheses.",15-Sep-2025,Didn't understood question properly and faced issue in the approach
LruCacheTest,Hard,Implement an LRU (Least Recently Used) cache.,"Data Structure Design, Doubly Linked List, Hash Map",The O(1) complexity requires a data structure that allows O(1) look-up and O(1) deletion/insertion. Combine a HashMap (to store key → node address) with a Doubly Linked List (to store the usage order). The least recently used (LRU) item is always at the tail of the list.,15-Sep-2025,Tricky approach and difficult implementation
GasStation,Hard,Find starting gas station to complete circular route.,"Greedy, Array/Circular Array Traversal","The key is that if the total gas is ≥ total cost, a solution must exist. Start at index 0. Track a ‘current_balance‘. If ‘current_balance‘ becomes negative, reset the ‘current_balance‘ to 0 and set the start position to the next index.",,Unintuitive. Got confused on why we don't need to loop the array till the start of the trip.
Bipartite,Hard,Determine if a graph is bipartite.,"Graph Traversal (BFS/DFS), Coloring","A graph is bipartite if its nodes can be divided into two disjoint sets such that every edge connects a node in one set to one in the other. Use BFS or DFS to traverse the graph and color the nodes with two colors, ensuring adjacent nodes have different colors. Check all components.",,Had forgot the problem and the way to approach. Need to ensure that we are checking for all the subgraphs
MinimumMaxCostAfterKComponents,Hard,Minimize maximum cost after dividing into k components.,"Graph (MST), Kruskal's/Prim's Algorithm",This is a variation of the Minimum Spanning Tree (MST) problem. Kruskal's or Prim's algorithm finds the minimum total cost. The variation often involves finding the K largest or K smallest edges in the MST.,,"Forgot kurskal and Prim algo, need to revise"
IncreasingNDigitNumbers,,Count n-digit numbers with increasing digits.,,,,
LruCacheTest,Hard,Implement an LRU (Least Recently Used) cache.,"Data Structure Design, Doubly Linked List, Hash Map",(See previous entry for LruCacheTest). Combine a HashMap (key → node address) with a Doubly Linked List (usage order) for O(1) look-up and O(1) update/delete.,,Faced issue with the data structures to use
MinSubarraySum,Impossible,"GIven an interger array, find the sum of the minimum value of all possible contiguous subarrays.","Monotonic Stack, Contribution Technique",The contribution of A[i] to the total sum is A[i]×(number of subarrays where A[i] is the minimum). Use a Monotonic Stack to find the index of the nearest smaller element to the left and the nearest smaller element to the right of A[i].,,Unintuitive approach. Iterate through all the indices and find all the subarrays for which this woud be min. Then calculate the contirubtion of this index in the final result
MinStackClass,Medium,"Design a stack that supports push, pop, top, and retrieving minimum in O(1).","Stack, Auxiliary Storage","To achieve O(1) for ‘getMin‘, use an Auxiliary Stack to track the current minimum element at each state of the main stack. When pushing, push the new element to the main stack and min(new_element,current_min) to the auxiliary stack.",,"Difficulty with the approach. Forgot about min Stack, where I can store the minimums. Easy implementation"
LargestHistogram,Hard,Find largest rectangle in histogram.,"Monotonic Stack, Nearest Smaller Element","Use a Monotonic Increasing Stack to find, for each bar, the first smaller bar to the left and the first smaller bar to the right. These two indices define the maximum width for which the current bar is the height. The maximum area is max(height[i]×(right_index−left_index−1)).",,Difficult to think about the solution which uses monotonic stack. Code understanding is also difficult where while loop is created and finding the boundaries
NextGreaterElement,Medium,Find next greater element for each element in array.,"Monotonic Stack, Hash Map","Use a Monotonic Stack (decreasing order). Iterate through the second array nums2. When pushing an element, pop all smaller elements from the stack; the element being pushed is their Next Greater Element. Store the results in a HashMap.",,Easy to come up with the approach as previous questions with monotonic stack were practiced
NextGreaterElementII,Hard,Find next greater element in circular array.,"Monotonic Stack, Circular Array","This is the same as the non-circular version, but you need to simulate a circular array. This can be achieved by iterating through the array twice (or iterating once over the concatenated array nums+nums). The stack stores indices, and the array size is handled by indexmodN.",,Not intuitive approach
RemoveDuplicateRecursively,Medium,Remove consecutive duplicates recursively.,"Stack, Recursion/Iteration","Use a Stack (or a string/list used as a stack) to build the result. When processing the current character, check the top of the stack. If they match, pop (delete) until the duplicate sequence is cleared. If they don't match, push the current character.",,Easy to come up with the approach as previous questions with monotonic stack were practiced
SingleThreadCPU,Very Hard,"Given tasks with [enqueueTime, processingTime], simulate single-threaded CPU task scheduling which prefer to pick tasks with shortest processing time","Min-Heap, Greedy, Scheduling","Use two Min-Heaps. One to store available tasks (ordered by processing time, then index) and one to store pending tasks (ordered by enqueue time). At each step, move all tasks that have arrived (enqueue time ≤ current time) from the pending heap to the available heap. Then, greedily pick the task with the minimum processing time from the available heap.",,
NiceSubarray,Hard,Count number of nice subarrays. Nice subarray is subarray with exactly k odd numbers.,"Hash Map, Prefix Sum, Sliding Window",Replace odd numbers with 1 and even numbers with 0. The problem reduces to finding the number of subarrays with a sum equal to K. Use the Prefix Sum + HashMap technique (similar to SumSubarrayFinder).,,
QueueUsingStack,Hard,Implement a queue using stacks.,"Stack, Two Stacks","Use Two Stacks, ‘input_stack‘ and ‘output_stack‘. Push goes to the ‘input_stack‘. Pop and Peek check the ‘output_stack‘. If ‘output_stack‘ is empty, transfer all elements from ‘input_stack‘ to ‘output_stack‘ before popping/peeking.",,Using single stack is hard
ReversePolishNotation,Easy,Evaluate Reverse Polish Notation expression.,"Stack, Expression Evaluation","Use a Stack. Iterate through the expression. If the token is a number, push it onto the stack. If the token is an operator, pop the two operands, perform the operation, and push the result back onto the stack.",,
FirstNonRepeating,Easy,Find first non-repeating character in a string.,"Queue, Hash Map, Data Stream","Use a Queue to maintain the order of characters seen so far. Use a HashMap to store the frequency of each character. When a character is added, update its frequency in the map. Then, dequeue elements from the front of the queue until the element at the front has a frequency of 1 (or the queue is empty).",2-Sep-2025,Difficult approach. Didn't understand the correct data structures to be used. Forgot the ds linked hashmap and tree maps etc
LfuCacheTest,Impossible,Implement an LFU (Least Frequently Used) cache.,"Data Structure Design, Doubly Linked List, Hash Map","Use three maps: key→value, key→frequency, and frequency→keys. When a key’s frequency increases, move it to the next bucket; if the old bucket becomes empty and was the minimum, increment minFrequency. New keys always start at frequency 1, so minFrequency resets to 1.",15-Sep-2025,
ParenthesisChecker,Easy,Validate parentheses in an expression.,"Stack, String/Expression Validation","Use a Stack. Push open parentheses onto the stack. When a closing parenthesis is encountered, check if the stack is non-empty and the top of the stack is the matching open parenthesis; if so, pop. If not, the string is invalid. The stack must be empty at the end for the string to be valid.",,Easy solution and appraoch
MaxBinaryRectangle,Medium,Find maximal rectangle containing only 1s in binary matrix.,"Dynamic Programming, Monotonic Stack (Largest Histogram)","This problem reduces to the Largest Rectangle in Histogram problem for each row. DP State: height[j] is the number of consecutive 1's ending at matrix[i][j] in the column j. Iterate through each row, update the ‘height‘ array, and then apply the Monotonic Stack (Largest Histogram) solution on the ‘height‘ array.",,
IntersectionList,Hard,Find intersection point of two linked lists.,"Two Pointers, Linked List","Use Two Pointers, ptrA starting at headA and ptrB starting at headB. When a pointer reaches ‘null‘, redirect it to the head of the other list (e.g., ptrA goes to headB). After at most two full traversals, the pointers will either meet at the intersection node or both will be ‘null‘ (if there is no intersection).",3-Sep-2025,Approach of solution without finding length is tricky
SwapPairs,Impossible,Swap every two adjacent nodes in a linked list.,"Linked List, Iterative/Recursive Reversal","Use a Dummy Node to handle the head. Use an iterative approach with three pointers: ‘prev‘, ‘first‘, and ‘second‘. The key is updating ‘prev‘. ‘prev‘.next points to ‘second‘, ‘first‘.next points to ‘second‘.next, and ‘second‘.next points to ‘first‘. Then ‘prev‘ moves to ‘first‘.",16-Sep-2025,really hard to understand the pointers movement
ReverseNodesInKGroup,Impossible,Reverse nodes in k-group in a linked list.,"Linked List, Iterative Reversal, Grouping","Use a Dummy Node. Use a helper function or recursive logic to reverse a sublist of size K. Before reversing, check if there are at least K nodes remaining. The key is correctly connecting the tail of the reversed group to the head of the next group, and the ‘prev‘ node to the head of the reversed group.",16-Sep-2025,
LinkedList,Easy,Implement basic linked list operations.,"Linked List, Node Manipulation","Basic operations involve traversing, inserting, and deleting nodes. Remember to handle the head and tail cases, and use a prev pointer for deletions.",,
RotateList,Easy,Rotate a linked list to the right by k places.,"Linked List, Cycle/Tail Manipulation","First, find the length L. Then, normalize k as k=kmodL. Connect the tail to the head to form a ring. The new head is at position L−k. Break the ring at the node just before the new head.",,
MiddleElement,Easy,Find middle element of a linked list.,"Linked List, Two Pointers (Slow/Fast)","Use the Slow and Fast Pointers technique. The ‘slow‘ pointer moves by 1, and the ‘fast‘ pointer moves by 2. When ‘fast‘ reaches the end, ‘slow‘ will be at the middle of the list.",,
