Task,Difficulty,Problem Statement,Patterns,Hints,Last Revised Date,Notes
ReverseLinkedList,Hard,Reverse a singly linked list.,"Linked List, Iterative Reversal","Use Three Pointers: ‘prev‘ (starts at null), ‘curr‘ (starts at head), and ‘next_node‘. In a loop, set ‘curr‘.next=‘prev‘, update ‘prev‘=‘curr‘, and ‘curr‘=‘next_node‘.",,Faced difficulty in follow up of reverse in group
ReverseLinkedListII,Very Hard,Reverse a linked list from position m to n.,"Linked List, Sublist Reversal","Use a Dummy Node. Traverse to the node before the start position (m). Mark this as ‘prev‘. Then, perform the standard iterative reversal on the sublist from m to n, keeping track of the tail (‘m_node‘). The key is reconnecting the list: ‘prev‘.next=new_head (which is the node at n), and ‘m_node‘.next=node_after_n.",,
PalindromeList,Hard,Check if a linked list is a palindrome.,"Linked List, Reversal, Two Pointers","1) Find the middle of the list using Slow/Fast Pointers. 2) Reverse the second half of the list. 3) Compare the first half and the reversed second half element by element. 4) (Optional, but good practice) Reverse the second half back to restore the original list.",,Have multiple questions together
InsertSortedCircularLinkedList,Hard,Insert a value into a sorted circular linked list.,"Linked List, Circular, Case Analysis",Case Analysis is crucial: 1) The new node is inserted between two nodes where node.val≤insertVal≤node.next.val. 2) The list is empty or has one element. 3) The new node has the minimum/maximum value (requires traversing the list to find the tail/max element).,,Have multiple cases
ReverseListInKGroup,Hard,Reverse linked list in groups of k.,"Linked List, Sublist Reversal, Grouping","(Same as ReverseNodesInKGroup) The key is managing the connection pointers. Use a Dummy Node. Reverse a sublist of size K and connect the previous node to the new head, and the tail of the reversed group to the next un-reversed node.",,
OddEvenLinkedList,Hard,Group odd and even positioned nodes together.,"Linked List, Two Pointers, Splitting","Use Two Pointers (‘odd‘ and ‘even‘ heads) to split the list into two separate lists: one for odd-indexed nodes and one for even-indexed nodes. Finally, connect the tail of the odd list to the head of the even list.",,
SnapshotArray,Very Hard,"Implement a snapshot array supporting set(index, value), snap(), and get(index, snapshotId) operations.","Custom Data Structure, Persistent Array, Map of Maps","Create complex datastructure containing Map<Index, TreeMap<SnapId, Value>> to store the value snapshot wise. Another variable `snapId` to get the current snapshot id",,
CreateExpression,Easy,Create an expression that evaluates to a target value.,"Backtracking, Recursion, Expression Generation","Use Backtracking/DFS. Recursively try adding ’+’, ’-’, or ’*’, or appending the current digit to the number formed so far. The recursion terminates when all digits are used.",,
MaximalString,Medium,Find lexicographically largest string after k swaps.,"Backtracking, String Manipulation, Swapping","Use Backtracking/DFS. The depth of the recursion is k (the max number of swaps). At each step, iterate through all possible pairs of indices (i,j) where string[i]<string[j], swap them, and recurse. Only track the maximum string found.",,
GuessingGame,Medium,Implement a number guessing game.,"Binary Search, Search Space Reduction","Since the API gives a hint (-1,0,1), use Binary Search to quickly converge on the correct number, continuously halving the range [low,high].",,
GuessingGame2,Hard,Find minimum amount of money to guarantee a win in guessing game.,"Dynamic Programming, MiniMax, Game Theory","DP State: dp[i][j] is the minimum guaranteed cost to win the game when the range of possible numbers is [i,j]. Recurrence: dp[i][j]=mink=ij​(k+max(dp[i][k−1],dp[k+1][j])). The guess k incurs a cost of k plus the cost of the worst-case subsequent game (max of left or right subproblems).",,
MaxEvents,Hard,Maximize number of events you can attend.,"Greedy, Sorting, Min-Heap","Greedy Approach: Sort the events by their start day. Iterate through the days from 1 to the maximum end day. On each day, first, add all events that start on that day to a Min-Heap (ordered by their end day). Then, greedily attend the event from the heap that ends earliest.",,Could not understand greedy approach will work here
MaxResourceAccess,Medium,Maximize resource access with given constraints.,Sliding Window,"Group all access timestamps by resource. For each resource, sort its timestamps and use a sliding window (two pointers) to find the maximum number of accesses within any 5-minute window",,
RemoveParenthesis,Very Hard,Remove minimum invalid parentheses.,"BFS, String Validation, Minimizing Deletions","Use BFS on strings. The states are the strings generated by removing one parenthesis at a time. The first level where a valid parenthesis string is found, all strings at that level are the result (minimizing deletions).",,
PermutationGenerator,Hard,Generate all permutations of an array.,"Backtracking, Recursion, Itertools","Use Backtracking/DFS. The key is to swap the current element with all elements to its right to generate new permutations. Alternatively, use a boolean/set to track used elements.",,
Subset,Hard,Generate all subsets of a set.,"Backtracking/Iteration, Bit Manipulation","Iterative: Start with an empty set. For each number in the input, create a new subset by adding the current number to all existing subsets. Bit Manipulation: Iterate from 0 to 2N−1. Each number's binary representation corresponds to a subset, where the i-th bit being set means the i-th element is included.",22-Sep-2025,Iterative approach is hard
Subset2,Hard,Generate all subsets avoiding duplicates.,"Backtracking/Recursion, Duplicate Handling","Sort the input array first. Use Backtracking/DFS. The critical step is to skip duplicates: if index>start and nums[index]=nums[index−1], then continue to the next iteration to prevent duplicate subsets.",22-Sep-2025,Little bit difficult to come up with this
NQueen2,Impossible,Count number of solutions to N-Queens problem.,"Backtracking, Bit Manipulation","Bitwise Optimization: Instead of a boolean array/set for columns and diagonals, use three integers (bitmasks): ‘col‘, ‘diag1‘ (row+col), and ‘diag2‘ (row−col). Use bitwise operations to check and mark occupied positions in O(1).",,Bitwise approach required more study
Permutation,Medium,Generate all permutations of distinct integers.,"Backtracking, Recursion","Use Backtracking/DFS. At each step, iterate through the elements. If an element is not used, add it to the current permutation, mark it as used, and recurse. Backtrack by unmarking and removing.",3-Sep-2025,
Permutation2,Medium,Generate all permutations with possible duplicates.,"Backtracking, Recursion, Duplicate Handling","Sort the array first. Use Backtracking/DFS. When iterating through the elements, if the current element is the same as the previous one AND the previous one was not used (meaning it was already processed in the loop at the same level), skip the current element to avoid duplicate permutations.",3-Sep-2025,
GrayCode,Very Hard,Generate n-bit Gray code sequence.,"Bit Manipulation, Pattern Recognition","The k-th Gray Code can be calculated directly as k⊕(k/2) or k⊕(k≫1). Alternatively, use a recursive pattern: Gray(n) is Gray(n−1) followed by the reverse of Gray(n−1) with a 1 prepended to each element.",,Bitwise approach required more study
WordPattern2,Hard,Check if a string follows a given pattern with full bijection.,"Backtracking, String Partitioning, Hash Map",Use Backtracking/DFS. Try every possible split of the string s into a word that maps to the current character in pattern. Use HashMap for pattern_char→word to ensure a one-to-one mapping.,,Not intuitive
EqualSumSubsetPartition,Hard,Partition array into two subsets with equal sum.,"Dynamic Programming, Subset Sum",This problem reduces to finding if there exists a subset that sums to total_sum/2. DP State: dp[s] is true if a subset with sum s exists. The total sum must be even.,,
KthPermutation,Impossible,Find the kth permutation sequence.,"Math, Factorial Number System","Use the Factorial Number System (or Cantor Expansion) to directly calculate the k-th permutation. At each step, divide k by (N−i)! to find the index of the digit to pick from the remaining pool of numbers.",,
NQueen,Medium,Solve the N-Queens puzzle.,"Backtracking, Recursion, Constraint Tracking","Use Backtracking/DFS. Place one queen per row. For each cell (row,col), check if a queen is already placed in the same column, main diagonal (row−col), or anti-diagonal (row+col).",,"Easy approach, faced some issue with diagonal/anti-diagonal"
KnightInChessBoard,Medium,Find minimum moves for knight to reach destination on chessboard.,"BFS, Shortest Path in Unweighted Graph","Since the movement cost is uniform (1 per move), the shortest path is found using Breadth-First Search (BFS). The states are the (row,col) coordinates, and the transitions are the eight possible knight moves.",,Got bit confused with BFS and DP. Easy to implement after that
SnakeLadder,Medium,Find minimum moves to reach end of snake and ladder board.,"BFS, Shortest Path in Graph",Treat the board as a graph. The shortest path in an unweighted graph is found by BFS. The nodes are the squares. The edges are the dice rolls (1 to 6). Snakes/Ladders are direct edges. Use a ‘visited‘ set to prevent cycles and re-processing.,,Got bit confused with the revisited cells. Easy to implement after that
SmallestMultiple,Impossible,Find smallest multiple of a number with only 0s and 1s.,"BFS, Modulo Arithmetic, Shortest Path",The state is ‘remainder‘ (modulo a target number N). The initial state is 1(modN). The transitions are multiplying by 10 (appending 0) or multiplying by 10 and adding 1 (appending 1). Use BFS to find the shortest sequence of 0's and 1's that reaches the state 0(modN).,,
ShortestBridge,Hard,Find shortest bridge connecting two islands.,"BFS, Multi-Source BFS, Two BFS Layers",Two-stage BFS: 1) Use DFS or BFS to find and mark all cells belonging to the first island. 2) Use a Multi-Source BFS starting from all cells of the first island to find the shortest distance to a cell of the second island. The distance (number of 0s traversed) is the number of flips.,,
MinBuses,Very Hard,"Given a list of bus routes [startPoint, stops ... , endPoint] and back to startPoint. Find minimum number of buses required to travel from a source stop to a destination stop","BFS, Graph, Stops/Bus Routes","This is a Shortest Path problem in a specialized graph. The nodes are the bus stops. The edges represent travelling between stops on a bus route. The challenge is that the ""cost"" is the number of buses taken. The state in BFS should be (‘stop‘, ‘buses_taken‘) or use a set of unseen bus routes to avoid cycles.",19-Sep-2025,
MakeLargeIsland,Hard,Make largest island by changing at most one 0 to 1.,"DFS/BFS, Union-Find, Component Sizing","1) Use DFS/BFS to find all connected components (islands) and calculate the size of each. Store the size in a Map with the component ID. 2) Iterate over all 0 cells. For each 0, check its 4 neighbors. Sum the unique island sizes of its neighbors. The max sum +1 (for the 0 itself) is the answer.",,
GoodNodesPath,Medium,Count good paths in a tree.,"Tree Traversal (DFS), Max Value Tracking","Use DFS (pre-order traversal). Pass the maximum value seen so far on the path from the root to the current node as an argument to the recursive function. A node is a ""good node"" if its value is ≥ the max value passed down.",,
MaxInvitations,Impossible,Maximize meeting invitations where guests are seated in circular table with favorite person sitting next to them,"Graph (Directed), Cycle Detection, Topological Sort",This is a graph problem with cycles. The max length is from either: 1) A 2-node cycle (A→B→A) plus the longest paths leading into those two nodes. 2) The maximum length of a single cycle of length ≥3.,21-Sep-2025,
ReconstructItinerary,Hard,Reconstruct itinerary from list of tickets.,"Graph (Directed), Euler Path/Circuit, Hierholzer's Algorithm","This is an Eulerian Path problem. Use DFS and a Priority Queue (Min-Heap) for the adjacency list to ensure lexicographical order. The result must be built backwards from the recursive calls. The path is formed by visiting all edges, and the stack/list is built on the way back up the recursion.",,
WaterFlow,Medium,Find cells where water can flow to both Pacific and Atlantic oceans.,"DFS/BFS, Multi-Source Traversal, Grid",The water can flow to the Pacific if there is a path from the cell to the top row or left column. Similarly for the Atlantic (bottom row or right column). Use Two separate DFS/BFS traversals starting from all cells bordering the Pacific and all cells bordering the Atlantic. A cell is the answer if it is reachable by both traversals.,,
CourseSchedule2,Medium,Find order to finish all courses given prerequisites.,"Topological Sort, Graph (Directed), BFS (Kahn's Algorithm)","Use Topological Sort (Kahn's Algorithm with BFS). 1) Calculate the in-degree of all nodes. 2) Initialize a queue with all nodes having an in-degree of 0. 3) While the queue is not empty, dequeue a node, add it to the result, and decrement the in-degree of all its neighbors. If a neighbor's in-degree reaches 0, enqueue it.",,
TicTacToeEndStates,Medium,Count valid end states of Tic-Tac-Toe.,"Game Theory, MiniMax/BFS (State Generation)","Analyze all possible Tic-Tac-Toe states reachable from an empty board. For a given board, check if it's a valid end state (by checking the number of X's vs O's) and then check for win conditions (row, column, diagonal).",,
TopologicalSort,Hard,Perform topological sort on a directed acyclic graph.,"Graph (Directed Acyclic), BFS/DFS","Use either BFS (Kahn's Algorithm) or DFS. BFS is generally preferred for its simplicity in implementation: track in-degrees, and use a queue for 0-in-degree nodes. DFS uses a recursive function and a ‘visited‘ status (unvisited, visiting, visited) to detect cycles.",,
PossibleRecipesFromSupplies,Hard,Find all recipes that can be created from given supplies.,"Topological Sort, Graph (Directed), Dependency",This is a Topological Sort problem. Create a graph where an ingredient is a dependency for a recipe. The nodes are recipes and supplies. Calculate the in-degree of each recipe (number of required ingredients). Use BFS starting from the initial ‘supplies‘ to unlock recipes (by reducing their in-degree).,,
MinimizeMaximumComponentCost,Very Hard,Minimize maximum cost among components.,"Binary Search on Answer, Graph (MST/Connectivity)",Use Kruskal Algorithm,,
MinimumArrowsToBurstBalloons,Hard,Find minimum arrows to burst all balloons.,"Greedy, Sorting, Interval Merging",This is a Greedy approach similar to interval merging. Sort the balloons by their end coordinate. Iterate through the sorted balloons. The current arrow must be placed at the end coordinate of the last burst balloon to maximize the number of subsequent balloons it can burst.,,
WordLadder2,Impossible,Find all shortest transformation sequences from start to end word.,"BFS, DFS, Graph, Shortest Path",Two-stage approach: 1) Use BFS to find the shortest distance from ‘beginWord‘ to all other words. This acts as a pruning step. 2) Use DFS (Backtracking) starting from ‘beginWord‘ to find all paths to ‘endWord‘ that are exactly the length found in the BFS.,21-Sep-2025,
OptimalAccountBalancing,Impossible,Minimize number of transactions to settle debts.,"Backtracking, Minimizing Transactions",1) Calculate the net balance for each person (how much they need to receive/pay). 2) This reduces to a Subset Sum or Partition problem. Use Backtracking/DFS to find the minimum number of transactions to zero out all balances. The state is the list of non-zero balances.,21-Sep-2025,
MinCostPath,Medium,Find minimum cost path in a grid from top-left to bottom-right.,"Dynamic Programming, Grid Traversal","DP State: dp[i][j] is the minimum cost to reach cell (i,j) from the top-left corner. Recurrence: dp[i][j]=grid[i][j]+min(dp[i−1][j],dp[i][j−1]).",,Easy to understand after creating graph notes
PathWithMinimumEffort,Hard,Find minEffortRequired to go from top left to bottom right. Effort of path is absolute max difference in height between 2 cells,,,,
CommutableIslands,Medium,Find minimum cost to connect all islands.,"Graph (MST), Kruskal's/Prim's Algorithm","This is a standard Minimum Spanning Tree (MST) problem. Use Kruskal's Algorithm with Union-Find to greedily add edges (bridges) in increasing order of weight, as long as they don't form a cycle.",,
LargestDistanceNodes,Hard,Find largest distance (no of edges) between any two nodes in a tree.,"Graph (Tree), Two BFS/DFS Traversals",The longest path in a tree (the diameter) is found with Two Traversals: 1) Run BFS/DFS from an arbitrary node A to find the farthest node B. 2) Run BFS/DFS from node B to find the farthest node C. The path from B to C is the diameter.,,
MaximalNetworkRank,Medium,Find maximal network rank of any two different cities.,"Graph, Adjacency Matrix/List","The network rank of two cities (A,B) is degree(A)+degree(B)−is_connected(A,B). Iterate over all pairs of cities (A,B), calculate their rank, and find the maximum.",,
AlienDictionary,Hard,Derive order of characters in alien language from sorted words.,"Topological Sort, Graph (Directed)","The lexicographical order from the words implies a set of directed edges (charA→charB) where A must come before B. Build a directed graph from these constraints. Then, run Topological Sort (Kahn's BFS or DFS) to find the valid character order.",,
CheapestFlightWithStops,Medium,Find cheapest flight with at most k stops.,"BFS (Modified), Bellman-Ford/Dijkstra (Modified)","This is a Shortest Path problem with a constraint on the number of edges (stops). Use a modified BFS or Bellman-Ford algorithm. The BFS state needs to track the number of stops (‘cost‘, ‘stops‘, ‘city‘) to ensure the K stops limit is not exceeded.",,
CurrencyConversion,Medium,Convert currency using given exchange rates.,"Graph (Directed, Weighted), DFS/Floyd-Warshall","This is a Shortest Path problem in a directed, weighted graph where weights are exchange rates. Use Floyd-Warshall to find all-pairs shortest paths, or a series of DFS/BFS traversals from a source to find the conversion factor.",,Forgot Dijkstra algo
ShortestDistance,Very Hard,"In a binary matrix, find shortest distance from each 1 to nearest 0",BFS,Use multi source BFS from all the zeroes,,Not able to come up with approach and problem in dijkstra algo
CourseSchedule,Hard,Determine if you can finish all courses given prerequisites.,"Topological Sort, Cycle Detection, Graph (Directed)","This reduces to cycle detection in a directed graph. A cycle means a course dependency is circular (e.g., A→B→A), making it impossible to finish. Use DFS with three states (unvisited, visiting, visited) to detect a back edge (cycle).",,
MaxAreaIsland,Easy,Find maximum area of island in a grid.,"DFS/BFS, Grid Traversal, Component Sizing",Use DFS or BFS to explore the connected component of 1's starting from an unvisited 1. Recursively/iteratively count the number of cells in the island. Keep track of the maximum size found.,,
NumberOfIslands,Easy,Count number of islands in a grid.,"DFS/BFS, Grid Traversal, Component Counting","Use DFS or BFS. Iterate over the grid. When a 1 is found, increment the counter and start a traversal (DFS/BFS) from that cell to mark all connected 1's as visited (or change them to 0).",,
CaptureRegions,Easy,Capture all regions surrounded by X in a board.,"DFS/BFS, Grid Traversal, Border-based Traversal","The only ’O’ regions that cannot be flipped are those connected to the border. Use DFS or BFS starting from all ’O’ cells on the border (first/last row/column) to mark all connected $\text{'O'}$s as safe ($\text{'#'}$). Finally, iterate through the grid: flip ’O’ to ’X’, and flip $\text{'#'}$ back to ’O’.",,
FibonacciSum,Medium,Find sum of Fibonacci numbers.,"Greedy, Fibonacci Numbers","This uses a property of Fibonacci numbers (Zeckendorf's theorem). Use a greedy approach: start with the largest Fibonacci number ≤k, subtract it from k, and repeat on the remainder.",,
UsefulExtraEdges,Very Hard,Find useful extra edges to add to a graph.,"Dijkstra's Algorithm, Multiple Shortest Paths","Run Dijkstra from the start node (S) to all nodes, and again from the end node (E) to all nodes on the reversed graph. Check each extra edge (u,v): if the path dist(S→u)+weight(u,v)+dist(v→E) is less than the current minimum, it's useful.",,
HighestRatedItem,Medium,Find highest rated item from a list.,"BFS, Grid Traversal, Custom Sorting","This is a Multi-Stage BFS and sorting problem. 1) Use BFS to find the shortest distance to all reachable items. 2) Store all reachable items as a tuple (‘distance‘, ‘price‘, ‘row‘, ‘col‘) and then sort this list using the custom criteria.",,
ShortestPath,Easy,Find shortest path between two nodes.,"BFS, Unweighted Graph",The shortest path in an unweighted graph is found using Breadth-First Search (BFS). The distance of a node is its ‘level‘ in the BFS tree.,,
WordLadder,Very Hard,Find length of shortest transformation sequence from start to end word.,"BFS, Bidirectional Search, Optimization","Use BFS. The state is the word. The transitions are one-letter changes. Optimization: Use Bidirectional BFS. Start two BFS traversals, one from ‘beginWord‘ and one from ‘endWord‘. When the two search frontiers meet, a shortest path has been found. This significantly reduces the search space.",,Bidirectional BFS and pattern using is difficult to think
Minesweeper,Medium,Simulate Minesweeper game reveal.,"DFS/BFS, Grid Traversal, State Transition","This is a DFS/BFS problem. If a click reveals a bomb (’M’), change it to ’X’. If it's an empty square, count the number of adjacent bombs. If count>0, change the cell to count (e.g., '1', '2'). If count=0, change it to ’B’ and recursively/iteratively reveal all its unrevealed neighbors.",,
CourseScheduleIV,Very Hard,"given an array of prerequisite pairs and a list of query pairs.For each query [u, v], determine whether u is a prerequisite of v (directly or indirectly).","Graph (Directed), Floyd-Warshall/Transitive Closure",Use the Floyd-Warshall algorithm to calculate all-pairs reachability: reachable[i][j]=reachable[i][j]∨(reachable[i][k]∧reachable[k][j]).,,
MinCostSum,Hard,Find minimum cost to achieve a target sum.,"Dynamic Programming, Array Iteration","DP State: dp[i] is the minimum cost to reach the i-th step. Recurrence: dp[i]=cost[i]+min(dp[i−1],dp[i−2]) (or similar for the specific problem constraints).",,
WordSearch,Medium,Search for a word in a 2D board.,"Backtracking, DFS, Grid Traversal",Use Backtracking/DFS. Start a DFS from every cell in the grid. The DFS explores the 4 directions. The recursive call only proceeds if the next letter in the word matches the cell's character. Mark the current cell as visited for the duration of the recursive path.,,
WordSearch2,Very Hard,"Given a 2D board and a list of words from the dictionary, find all words that can be formed by sequentially adjacent letters from board","Trie, Backtracking, DFS","Optimization: Build a Trie from the list of words. Use DFS (Backtracking) on the grid. At each cell, check if the path formed so far is a prefix in the Trie. If a complete word is found, add it to the result and continue searching. This avoids checking a word that doesn't exist.",,
EvaluateDivision,Very Hard,Evaluate division equations using given variable relationships.,"Graph (Directed, Weighted), DFS/BFS, Union-Find",Treat the problem as a graph where nodes are variables and edge weights are the ratio. A/B=2.0 is an edge A→B with weight 2.0 and B→A with weight 1/2.0. Use DFS or BFS to find the path between the query variables. The result is the product of the edge weights along the path.,,
MaxSlidingWindow,Very Hard,Find maximum in each sliding window of size k.,"Deque (Double-Ended Queue), Monotonic Queue","Use a Monotonic Decreasing Deque. The deque stores the indices of elements. The front of the deque is always the index of the maximum element in the current window. When adding a new element, remove all smaller elements from the back of the deque. Before adding the new element, remove the index at the front if it's outside the window.",,
TaskScheduler,Very Hard,Find minimum time to complete tasks with cooling intervals.,"Greedy, Frequency Analysis, Slot Management",This is a Greedy approach based on frequency. The minimum time is determined by the most frequent task (max_freq). The time is at least (max_freq−1)×(n+1)+count(max_freq). The total time is the max of this calculated time and the total number of tasks.,,
PalindromePairs,Hard,Find all pairs of words that form palindromes when concatenated.,"Trie, Hash Map, Palindrome Check","Optimization: Use a Trie to store the reverse of all words. For each word in the original list, search for it in the reverse Trie. A pair (word1,word2) forms a palindrome if: 1) word2 is the reverse of word1. 2) word1 is prefix+palindrome and word2 is reverse(prefix). 3) word2 is palindrome+suffix and word1 is reverse(suffix).",,
WebsiteVisit,Medium,Find most visited website pattern.,"Hash Map, Time Series Analysis, Frequency","Group the website visits by user. For each user, extract all contiguous sequences of three website visits (trip1,trip2,trip3) in chronological order. Use a HashMap to count the frequency of each unique 3-sequence.",,
